{
  "instance_id": "test-instance-123",
  "credential_type": "all",
  "postgres_password": "new_postgres_password_123",
  "jwt_secret": "new_jwt_secret_456",
  "publishable_key": "eyJhbGciOiJIUzI1NiIsInR5cCI6IkpXVCJ9.eyJpc3MiOiJzdXBhYmFzZSIsInJlZiI6ImRlbW8iLCJyb2xlIjoiYW5vbiIsImlhdCI6MTY0MTc2OTIwMCwiZXhwIjoxOTU3MzQ1MjAwfQ.new_anon_key",
  "secret_key": "eyJhbGciOiJIUzI1NiIsInR5cCI6IkpXVCJ9.eyJpc3MiOiJzdXBhYmFzZSIsInJlZiI6ImRlbW8iLCJyb2xlIjoic2VydmljZV9yb2xlIiwiaWF0IjoxNjQxNzY5MjAwLCJleHAiOjE5NTczNDUyMDB9.new_service_role_key",
  "base_dir": "/opt/supabase"
}
